album,title,lyrics,lyrics_str
Lust for Life,God Bless America - and All the Beautiful Women in It,"['take', 'take', 'baby', 'stride', 'save', 'tonight', 'there', 'nowhere', 'run', 'nowhere', 'hide', 'let', 'leave', 'leave', 'dry', 'even', 'im', 'alone', 'im', 'lonely', 'hear', 'sweetest', 'melody', 'sweetest', 'melody', 'fire', 'escape', 'city', 'sound', 'like', 'free', 'got', 'singin', 'god', 'bless', 'america', 'beautiful', 'woman', 'god', 'bless', 'america', 'beautiful', 'woman', 'may', 'stand', 'proud', 'strong', 'like', 'lady', 'liberty', 'shinin', 'night', 'long', 'god', 'bless', 'america', 'take', 'see', 'im', 'hear', 'tonight', 'keep', 'light', 'babe', 'might', 'standin', 'outside', 'let', 'leave', 'leave', 'dry', 'even', 'walkin', 'alone', 'im', 'worried', 'feel', 'arm', 'around', 'arm', 'around', 'air', 'street', 'city', 'feel', 'like', 'free', 'got', 'thinkin', 'god', 'bless', 'america', 'beautiful', 'woman', 'god', 'bless', 'america', 'beautiful', 'woman', 'may', 'stand', 'proud', 'strong', 'like', 'lady', 'liberty', 'shinin', 'night', 'long', 'god', 'bless', 'america', 'bridge', 'sweetest', 'melody', 'even', 'ive', 'got', 'one', 'lose', 'better', 'believe', 'nobody', 'make', 'feel', 'lonely', 'hear', 'sweetest', 'melody', 'even', 'talk', 'talk', 'light', 'still', 'somehow', 'know', 'ill', 'never', 'feel', 'ever', 'feel', 'lonely', 'fear', 'got', 'thinkin', 'yeah', 'god', 'bless', 'america', 'beautiful', 'woman', 'god', 'bless', 'america', 'beautiful', 'people', 'may', 'stand', 'proud', 'strong', 'like', 'lady', 'liberty', 'shinin', 'night', 'long', 'god', 'bless', 'america', 'beautiful', 'people', 'beautiful', 'people']",take take baby stride save tonight there nowhere run nowhere hide let leave leave dry even im alone im lonely hear sweetest melody sweetest melody fire escape city sound like free got singin god bless america beautiful woman god bless america beautiful woman may stand proud strong like lady liberty shinin night long god bless america take see im hear tonight keep light babe might standin outside let leave leave dry even walkin alone im worried feel arm around arm around air street city feel like free got thinkin god bless america beautiful woman god bless america beautiful woman may stand proud strong like lady liberty shinin night long god bless america bridge sweetest melody even ive got one lose better believe nobody make feel lonely hear sweetest melody even talk talk light still somehow know ill never feel ever feel lonely fear got thinkin yeah god bless america beautiful woman god bless america beautiful people may stand proud strong like lady liberty shinin night long god bless america beautiful people beautiful people
Lust for Life,When the World Was at War We Kept Dancing,"['girl', 'forget', 'pearl', 'horse', 'make', 'way', 'across', 'pond', 'girl', 'forget', 'curl', 'corset', 'memorize', 'little', 'song', 'shake', 'throw', 'hand', 'get', 'loose', 'cut', 'rug', 'lean', 'fuckin', 'youth', 'choreo', 'want', 'fuckin', 'truth', 'told', 'fake', 'news', 'end', 'era', 'end', 'america', 'end', 'era', 'end', 'america', 'beginnin', 'hold', 'hope', 'well', 'happy', 'endin', 'world', 'war', 'kept', 'dancin', 'world', 'war', 'kept', 'dancin', 'boy', 'forget', 'toy', 'take', 'money', 'find', 'foreign', 'land', 'boy', 'make', 'much', 'noise', 'try', 'funny', 'people', 'may', 'understand', 'shake', 'throw', 'hand', 'get', 'loose', 'cut', 'rug', 'lean', 'fuckin', 'youth', 'choreo', 'want', 'fuckin', 'truth', 'told', 'fake', 'news', 'end', 'era', 'end', 'america', 'end', 'era', 'end', 'america', 'beginnin', 'hold', 'hope', 'well', 'happy', 'endin', 'world', 'war', 'kept', 'dancin', 'world', 'war', 'kept', 'dancin', 'bridge', 'well', 'oh', 'god', 'dizzy', 'lovin', 'well', 'oh', 'god', 'dizzy', 'lovin', 'well', 'lovin', 'well', 'world', 'war', 'end', 'era', 'end', 'america', 'end', 'era', 'end', 'america', 'world', 'war', 'kept', 'dancin', 'world', 'war', 'kept', 'dancin', 'outro', 'well', 'well']",girl forget pearl horse make way across pond girl forget curl corset memorize little song shake throw hand get loose cut rug lean fuckin youth choreo want fuckin truth told fake news end era end america end era end america beginnin hold hope well happy endin world war kept dancin world war kept dancin boy forget toy take money find foreign land boy make much noise try funny people may understand shake throw hand get loose cut rug lean fuckin youth choreo want fuckin truth told fake news end era end america end era end america beginnin hold hope well happy endin world war kept dancin world war kept dancin bridge well oh god dizzy lovin well oh god dizzy lovin well lovin well world war end era end america end era end america world war kept dancin world war kept dancin outro well well
Lust for Life,Beautiful People Beautiful Problems,"['blue', 'color', 'planet', 'view', 'long', 'live', 'reign', 'long', 'live', 'love', 'green', 'planet', 'eye', 'turtle', 'dove', 'til', 'run', 'red', 'run', 'red', 'blood', 'get', 'tired', 'complain', 'bout', 'hard', 'live', 'video', 'game', 'beautiful', 'people', 'beautiful', 'problem', 'yeah', 'beautiful', 'problem', 'god', 'know', 'weve', 'got', 'got', 'ta', 'try', 'lielalie', 'every', 'day', 'night', 'lielalie', 'stevie', 'nick', 'blue', 'collar', 'shirt', 'man', 'love', 'he', 'hard', 'work', 'hard', 'touch', 'warm', 'body', 'girl', 'land', 'love', 'heart', 'soft', 'past', 'rough', 'stevie', 'nick', 'love', 'get', 'feeling', 'something', 'close', 'like', 'sugar', 'rush', 'run', 'wasted', 'love', 'wasted', 'love', 'stevie', 'nick', 'stevie', 'nick', 'beautiful', 'people', 'beautiful', 'problem', 'yeah', 'beautiful', 'problem', 'god', 'know', 'weve', 'got', 'got', 'ta', 'try', 'lielalie', 'every', 'day', 'night', 'lielalie', 'bridge', 'stevie', 'nick', 'yeah', 'weve', 'got', 'ta', 'try', 'lielalie', 'got', 'ta', 'walk', 'fire', 'lielalie', 'stevie', 'nick', 'stevie', 'nick', 'beautiful', 'people', 'beautiful', 'problem', 'yeah', 'beautiful', 'problem', 'god', 'know', 'weve', 'got', 'beautiful', 'people', 'beautiful', 'people', 'beautiful', 'problem', 'yeah', 'beautiful', 'problem', 'god', 'know', 'weve', 'got', 'outro', 'stevie', 'nick', 'beautiful', 'yeah', 'yeah', 'yeah']",blue color planet view long live reign long live love green planet eye turtle dove til run red run red blood get tired complain bout hard live video game beautiful people beautiful problem yeah beautiful problem god know weve got got ta try lielalie every day night lielalie stevie nick blue collar shirt man love he hard work hard touch warm body girl land love heart soft past rough stevie nick love get feeling something close like sugar rush run wasted love wasted love stevie nick stevie nick beautiful people beautiful problem yeah beautiful problem god know weve got got ta try lielalie every day night lielalie bridge stevie nick yeah weve got ta try lielalie got ta walk fire lielalie stevie nick stevie nick beautiful people beautiful problem yeah beautiful problem god know weve got beautiful people beautiful people beautiful problem yeah beautiful problem god know weve got outro stevie nick beautiful yeah yeah yeah
Lust for Life,Tomorrow Never Came,"['hey', 'doin', 'lot', 'shakin', 'movin', 'local', 'spot', 'baby', 'ask', 'ask', 'lay', 'lady', 'lay', 'side', 'paradise', 'tropic', 'cancer', 'cause', 'way', 'would', 'always', 'stay', 'id', 'tiny', 'dancer', 'honey', 'waited', 'spot', 'said', 'wait', 'city', 'park', 'bench', 'middle', 'pourin', 'rain', 'cause', 'adored', 'wanted', 'thing', 'said', 'meet', 'tomorrow', 'tomorrow', 'never', 'came', 'tomorrow', 'never', 'came', 'sean', 'lennon', 'hey', 'thinkin', 'penny', 'thought', 'light', 'blinkin', 'old', 'jukebox', 'ask', 'swallow', 'wine', 'wiwiwiwiwiwiwine', 'sean', 'lennon', 'stay', 'baby', 'stay', 'side', 'paradise', 'tropic', 'cancer', 'cause', 'way', 'would', 'always', 'stay', 'tiny', 'dancer', 'baby', 'sean', 'lennon', 'waited', 'spot', 'said', 'wait', 'city', 'park', 'bench', 'middle', 'pourin', 'rain', 'cause', 'adored', 'wanted', 'thing', 'said', 'meet', 'tomorrow', 'tomorrow', 'never', 'came', 'tomorrow', 'never', 'came', 'bridge', 'rose', 'country', 'house', 'played', 'guitar', 'barn', 'everyday', 'felt', 'like', 'sunday', 'wish', 'stayed', 'home', 'could', 'put', 'radio', 'favorite', 'song', 'lennon', 'yoko', 'would', 'play', 'day', 'long', 'life', 'crazy', 'said', 'im', 'singin', 'sean', 'whoa', 'sean', 'lennon', 'could', 'keep', 'waitin', 'spot', 'wed', 'always', 'wait', 'city', 'park', 'bench', 'summer', 'pourin', 'rain', 'honey', 'ignore', 'wanted', 'said', 'love', 'like', 'tomorrow', 'guess', 'tomorrow', 'never', 'came', 'tomorrow', 'never', 'came', 'tomorrow', 'never', 'came', 'tomorrow', 'never']",hey doin lot shakin movin local spot baby ask ask lay lady lay side paradise tropic cancer cause way would always stay id tiny dancer honey waited spot said wait city park bench middle pourin rain cause adored wanted thing said meet tomorrow tomorrow never came tomorrow never came sean lennon hey thinkin penny thought light blinkin old jukebox ask swallow wine wiwiwiwiwiwiwine sean lennon stay baby stay side paradise tropic cancer cause way would always stay tiny dancer baby sean lennon waited spot said wait city park bench middle pourin rain cause adored wanted thing said meet tomorrow tomorrow never came tomorrow never came bridge rose country house played guitar barn everyday felt like sunday wish stayed home could put radio favorite song lennon yoko would play day long life crazy said im singin sean whoa sean lennon could keep waitin spot wed always wait city park bench summer pourin rain honey ignore wanted said love like tomorrow guess tomorrow never came tomorrow never came tomorrow never came tomorrow never
Lust for Life,Heroin,"['topanga', 'hot', 'tonight', 'city', 'bay', 'movie', 'star', 'liquor', 'store', 'soft', 'decay', 'rumblin', 'distant', 'shore', 'sends', 'sleep', 'fact', 'life', 'sometimes', 'make', 'hard', 'dream', 'life', 'rocked', 'like', 'mötley', 'grabbed', 'ribbon', 'hair', 'life', 'rocked', 'ultra', 'softly', 'like', 'heavy', 'metal', 'wear', 'im', 'flyin', 'moon', 'dreamin', 'heroin', 'gave', 'everything', 'took', 'life', 'away', 'put', 'aeroplane', 'destined', 'foreign', 'land', 'hoped', 'come', 'back', 'tell', 'everythings', 'okay', 'ay', 'babe', 'yeah', 'topangas', 'hot', 'today', 'manson', 'air', 'friend', 'gone', 'cause', 'still', 'feel', 'want', 'leave', 'ill', 'probably', 'stay', 'another', 'year', 'hard', 'leave', 'absolutely', 'nothing', 'clear', 'life', 'rocked', 'like', 'mötley', 'bad', 'beginnin', 'new', 'year', 'life', 'rocked', 'ultra', 'softly', 'like', 'heavy', 'metal', 'hear', 'im', 'flyin', 'moon', 'dreamin', 'heroin', 'gave', 'everything', 'took', 'life', 'away', 'put', 'aeroplane', 'destined', 'foreign', 'land', 'thought', 'come', 'back', 'tell', 'everythings', 'okay', 'ay', 'babe', 'yeah', 'bridge', 'fucking', 'hot', 'hot', 'winter', 'city', 'somethin', 'bout', 'weather', 'made', 'kid', 'go', 'crazy', 'hot', 'even', 'february', 'somethin', 'bout', 'sun', 'made', 'kid', 'get', 'scary', 'oh', 'writin', 'blood', 'wall', 'shit', 'like', 'ah', 'oh', 'god', 'jumpin', 'wall', 'dock', 'shit', 'oh', 'ho', 'ho', 'ho', 'id', 'lyin', 'said', 'sick', 'baby', 'baby', 'come', 'come', 'come', 'come', 'im', 'flyin', 'moon', 'dreamin', 'marzipan', 'taking', 'medicine', 'take', 'thought', 'away', 'im', 'getting', 'aeroplane', 'leavin', 'old', 'man', 'hope', 'come', 'back', 'one', 'day', 'tell', 'really', 'changed', 'baby', 'outro', 'hot', 'hot', 'somethin', 'bout', 'city', 'know', 'make', 'head', 'get', 'crazy', 'oh', 'make', 'feel', 'like', 'change', 'oh', 'ho', 'ho', 'ho', 'evil', 'way', 'shit', 'oh', 'id', 'lying', 'said', 'sick']",topanga hot tonight city bay movie star liquor store soft decay rumblin distant shore sends sleep fact life sometimes make hard dream life rocked like mötley grabbed ribbon hair life rocked ultra softly like heavy metal wear im flyin moon dreamin heroin gave everything took life away put aeroplane destined foreign land hoped come back tell everythings okay ay babe yeah topangas hot today manson air friend gone cause still feel want leave ill probably stay another year hard leave absolutely nothing clear life rocked like mötley bad beginnin new year life rocked ultra softly like heavy metal hear im flyin moon dreamin heroin gave everything took life away put aeroplane destined foreign land thought come back tell everythings okay ay babe yeah bridge fucking hot hot winter city somethin bout weather made kid go crazy hot even february somethin bout sun made kid get scary oh writin blood wall shit like ah oh god jumpin wall dock shit oh ho ho ho id lyin said sick baby baby come come come come im flyin moon dreamin marzipan taking medicine take thought away im getting aeroplane leavin old man hope come back one day tell really changed baby outro hot hot somethin bout city know make head get crazy oh make feel like change oh ho ho ho evil way shit oh id lying said sick
Lust for Life,Change,"['there', 'somethin', 'wind', 'feel', 'blowin', 'comin', 'softly', 'wing', 'bomb', 'there', 'somethin', 'wind', 'feel', 'blowin', 'comin', 'hotly', 'coming', 'strong', 'refrain', 'lately', 'ive', 'thinkin', 'someone', 'el', 'job', 'care', 'sympathize', 'one', 'gave', 'damn', 'ive', 'thinkin', 'someone', 'el', 'job', 'care', 'wan', 'na', 'try', 'change', 'powerful', 'thing', 'people', 'powerful', 'being', 'tryin', 'find', 'power', 'faithful', 'change', 'powerful', 'thing', 'feel', 'comin', 'maybe', 'time', 'summer', 'done', 'ill', 'able', 'honest', 'capable', 'holdin', 'arm', 'without', 'lettin', 'fall', 'feel', 'beautiful', 'stable', 'maybe', 'enough', 'every', 'time', 'run', 'know', 'finally', 'slow', 'feel', 'close', 'there', 'change', 'gon', 'na', 'come', 'know', 'whenever', 'well', 'there', 'somethin', 'wind', 'feel', 'blowin', 'comin', 'softly', 'wing', 'song', 'there', 'somethin', 'water', 'taste', 'turnin', 'sour', 'bitter', 'im', 'coughin', 'blood', 'refrain', 'lately', 'ive', 'thinkin', 'someone', 'el', 'job', 'care', 'sympathize', 'one', 'gave', 'damn', 'ive', 'thinkin', 'someone', 'el', 'job', 'care', 'cause', 'wan', 'na', 'try', 'change', 'powerful', 'thing', 'people', 'powerful', 'being', 'tryin', 'find', 'power', 'faithful', 'change', 'powerful', 'thing', 'feel', 'comin', 'maybe', 'time', 'summer', 'done', 'ill', 'able', 'honest', 'capable', 'holdin', 'arm', 'without', 'letting', 'fall', 'feel', 'beautiful', 'stable', 'maybe', 'enough', 'every', 'time', 'run', 'know', 'finally', 'slow', 'feel', 'close', 'there', 'change', 'gon', 'na', 'come', 'know', 'whenever', 'well', 'outro', 'yeah', 'whenever', 'well', 'whenever', 'well']",there somethin wind feel blowin comin softly wing bomb there somethin wind feel blowin comin hotly coming strong refrain lately ive thinkin someone el job care sympathize one gave damn ive thinkin someone el job care wan na try change powerful thing people powerful being tryin find power faithful change powerful thing feel comin maybe time summer done ill able honest capable holdin arm without lettin fall feel beautiful stable maybe enough every time run know finally slow feel close there change gon na come know whenever well there somethin wind feel blowin comin softly wing song there somethin water taste turnin sour bitter im coughin blood refrain lately ive thinkin someone el job care sympathize one gave damn ive thinkin someone el job care cause wan na try change powerful thing people powerful being tryin find power faithful change powerful thing feel comin maybe time summer done ill able honest capable holdin arm without letting fall feel beautiful stable maybe enough every time run know finally slow feel close there change gon na come know whenever well outro yeah whenever well whenever well
Lust for Life,Get Free,"['finally', 'im', 'crossing', 'threshold', 'ordinary', 'world', 'reveal', 'heart', 'undoubtedly', 'certain', 'take', 'dead', 'sea', 'darkness', 'art', 'commitment', 'modern', 'manifesto', 'im', 'doin', 'u', 'never', 'got', 'chance', 'shut', 'shut', 'bird', 'paradise', 'shut', 'shut', 'never', 'got', 'fly', 'night', 'shut', 'shut', 'cause', 'caught', 'dance', 'sometimes', 'feel', 'like', 'ive', 'got', 'war', 'mind', 'want', 'get', 'keep', 'ridin', 'ride', 'never', 'really', 'noticed', 'decide', 'play', 'someone', 'game', 'live', 'life', 'wan', 'na', 'move', 'black', 'black', 'blue', 'blue', 'finally', 'gone', 'burden', 'crowley', 'way', 'come', 'energy', 'combined', 'like', 'part', 'discernin', 'found', 'right', 'mind', 'there', 'chasing', 'rainbow', 'hoping', 'end', 'arch', 'illusion', 'solid', 'first', 'glance', 'try', 'touch', 'touch', 'touch', 'there', 'nothing', 'hold', 'hold', 'hold', 'color', 'used', 'lure', 'shut', 'shut', 'put', 'trance', 'ah', 'ah', 'ah', 'yeah', 'sometimes', 'feel', 'like', 'ive', 'got', 'war', 'mind', 'want', 'get', 'keep', 'ridin', 'ride', 'never', 'really', 'noticed', 'decide', 'play', 'someone', 'game', 'live', 'life', 'wan', 'na', 'move', 'black', 'black', 'blue', 'blue', 'black', 'black', 'blue', 'blue', 'black', 'black', 'blue']",finally im crossing threshold ordinary world reveal heart undoubtedly certain take dead sea darkness art commitment modern manifesto im doin u never got chance shut shut bird paradise shut shut never got fly night shut shut cause caught dance sometimes feel like ive got war mind want get keep ridin ride never really noticed decide play someone game live life wan na move black black blue blue finally gone burden crowley way come energy combined like part discernin found right mind there chasing rainbow hoping end arch illusion solid first glance try touch touch touch there nothing hold hold hold color used lure shut shut put trance ah ah ah yeah sometimes feel like ive got war mind want get keep ridin ride never really noticed decide play someone game live life wan na move black black blue blue black black blue blue black black blue
Norman Fucking Rockwell!,Norman fucking Rockwell,"['goddamn', 'manchild', 'fucked', 'good', 'almost', 'said', 'love', 'fun', 'wild', 'know', 'half', 'shit', 'put', 'poetry', 'bad', 'blame', 'news', 'cant', 'change', 'cant', 'change', 'mood', 'ah', 'cause', 'man', 'head', 'hand', 'color', 'blue', 'yeah', 'man', 'head', 'hand', 'color', 'blue', 'blue', 'blue', 'blue', 'goddamn', 'manchild', 'act', 'like', 'kid', 'even', 'though', 'stand', 'six', 'foot', 'two', 'selfloathing', 'poet', 'resident', 'laurel', 'canyon', 'knowitall', 'talk', 'wall', 'party', 'get', 'bored', 'get', 'bored', 'see', 'wait', 'best', 'could', 'cause', 'man', 'head', 'hand', 'color', 'blue', 'yeah', 'man', 'head', 'hand', 'color', 'blue', 'blue', 'blue', 'make', 'blue', 'outro', 'blue', 'blue', 'blue', 'blue', 'blue', 'blue', 'blue']",goddamn manchild fucked good almost said love fun wild know half shit put poetry bad blame news cant change cant change mood ah cause man head hand color blue yeah man head hand color blue blue blue blue goddamn manchild act like kid even though stand six foot two selfloathing poet resident laurel canyon knowitall talk wall party get bored get bored see wait best could cause man head hand color blue yeah man head hand color blue blue blue make blue outro blue blue blue blue blue blue blue
Norman Fucking Rockwell!,Mariners Apartment Complex,"['took', 'sadness', 'context', 'mariner', 'apartment', 'complex', 'aint', 'candle', 'wind', 'im', 'board', 'lightning', 'thunder', 'kind', 'girl', 'who', 'gon', 'na', 'make', 'wonder', 'ive', 'beach', 'venice', 'bitch', 'diehard', 'weakness', 'maybe', 'could', 'save', 'sin', 'kiss', 'sky', 'whisper', 'jesus', 'found', 'need', 'take', 'deep', 'breath', 'baby', 'let', 'lose', 'way', 'take', 'hand', 'lost', 'sea', 'ill', 'command', 'boat', 'look', 'far', 'right', 'thats', 'im', 'man', 'im', 'man', 'mistook', 'kindness', 'weakness', 'fucked', 'know', 'jesus', 'cant', 'girl', 'best', 'catch', 'wave', 'take', 'sweetness', 'think', 'darkness', 'deepness', 'thing', 'make', 'bigtime', 'believer', 'people', 'change', 'leave', 'everyones', 'talking', 'make', 'stand', 'cause', 'even', 'dark', 'feel', 'resistance', 'see', 'heart', 'burning', 'distance', 'baby', 'baby', 'baby', 'im', 'man', 'yeah', 'lose', 'way', 'take', 'hand', 'lost', 'sea', 'ill', 'command', 'boat', 'look', 'far', 'right', 'thats', 'im', 'man', 'im', 'man', 'outro', 'catch', 'wave', 'take', 'sweetness', 'take', 'sweetness', 'want', 'need', 'ready', 'ready', 'ready']",took sadness context mariner apartment complex aint candle wind im board lightning thunder kind girl who gon na make wonder ive beach venice bitch diehard weakness maybe could save sin kiss sky whisper jesus found need take deep breath baby let lose way take hand lost sea ill command boat look far right thats im man im man mistook kindness weakness fucked know jesus cant girl best catch wave take sweetness think darkness deepness thing make bigtime believer people change leave everyones talking make stand cause even dark feel resistance see heart burning distance baby baby baby im man yeah lose way take hand lost sea ill command boat look far right thats im man im man outro catch wave take sweetness take sweetness want need ready ready ready
